{
  "$schema": "https://json-schema.org/draft/2020-12/schema",
  "$id": "https://github.com/richer-tunes/lidarr.plugin.common/docs/reference/e2e-run-manifest.schema.json",
  "title": "E2E Run Manifest",
  "description": "Schema for e2e-runner.ps1 JSON output. Validates test run results for CI/CD integration.",
  "type": "object",
  "additionalProperties": true,
  "required": [
    "schemaVersion",
    "schemaId",
    "timestamp",
    "runId",
    "runner",
    "lidarr",
    "request",
    "effective",
    "redaction",
    "results",
    "summary",
    "diagnostics",
    "hostBugSuspected"
  ],
  "properties": {
    "schemaVersion": {
      "const": "1.2",
      "description": "Schema version. Breaking changes require major bump."
    },
    "schemaId": {
      "const": "richer-tunes.lidarr.e2e-run-manifest",
      "description": "Stable schema identifier for cross-system recognition."
    },
    "timestamp": {
      "type": "string",
      "format": "date-time",
      "description": "ISO 8601 timestamp when manifest was generated."
    },
    "runId": {
      "type": "string",
      "minLength": 1,
      "description": "Unique run identifier (typically 12-char hex)."
    },
    "runner": {
      "type": "object",
      "additionalProperties": false,
      "required": ["name", "version", "args"],
      "properties": {
        "name": {
          "type": "string",
          "pattern": "e2e-runner",
          "description": "Runner script name."
        },
        "version": {
          "type": "string",
          "minLength": 1,
          "description": "Git short SHA or version."
        },
        "args": {
          "type": "array",
          "items": { "type": "string" },
          "description": "Command-line arguments (redacted)."
        }
      }
    },
    "sources": {
      "type": "object",
      "additionalProperties": true,
      "description": "Source provenance for repos (common, qobuzarr, tidalarr, brainarr, etc.).",
      "patternProperties": {
        "^[a-z]+$": {
          "type": "object",
          "additionalProperties": true,
          "required": ["sha", "source"],
          "properties": {
            "sha": {
              "type": ["string", "null"],
              "description": "Git short SHA (7 chars) or null if unknown."
            },
            "fullSha": {
              "type": ["string", "null"],
              "pattern": "^[a-f0-9]{40}$",
              "description": "Git full SHA (40 chars) for reproducibility, or null if unknown."
            },
            "source": {
              "type": "string",
              "description": "Provenance: git, env, or unknown."
            }
          }
        }
      }
    },
    "lidarr": {
      "type": "object",
      "additionalProperties": false,
      "required": ["url", "containerName"],
      "properties": {
        "url": {
          "type": "string",
          "description": "Lidarr API URL (IPs redacted)."
        },
        "containerName": {
          "type": "string",
          "description": "Docker container name."
        },
        "containerId": {
          "type": ["string", "null"],
          "description": "Docker container ID (12-char truncated)."
        },
        "startedAt": {
          "type": ["string", "null"],
          "format": "date-time",
          "description": "Container start time."
        },
        "imageTag": {
          "type": ["string", "null"],
          "description": "Docker image tag."
        },
        "imageId": {
          "type": ["string", "null"],
          "description": "Docker image SHA."
        },
        "imageDigest": {
          "type": ["string", "null"],
          "description": "Docker image digest."
        },
        "version": {
          "type": ["string", "null"],
          "description": "Lidarr version if queryable."
        },
        "branch": {
          "type": ["string", "null"],
          "description": "Lidarr branch if queryable."
        },
        "hostOverride": {
          "type": ["object", "null"],
          "additionalProperties": false,
          "required": ["used"],
          "description": "Optional host binary override used to work around Lidarr multi-plugin loader bugs.",
          "properties": {
            "used": {
              "type": "boolean",
              "description": "True if a host override DLL was mounted into the container."
            },
            "reason": {
              "type": ["string", "null"],
              "description": "Human-readable reason for enabling/disabling the override."
            },
            "sourceRepo": {
              "type": ["string", "null"],
              "description": "GitHub repository used to build the override binary."
            },
            "sourceRef": {
              "type": ["string", "null"],
              "description": "Git ref (branch/tag/SHA) used to build the override binary."
            },
            "sha": {
              "type": ["string", "null"],
              "description": "Resolved Git commit SHA used to build the override binary."
            },
            "dllSha256": {
              "type": ["string", "null"],
              "pattern": "^[a-f0-9]{64}$",
              "description": "SHA256 hash of the mounted Lidarr.Common.dll for forensics and reproducibility."
            }
          }
        },
        "capabilities": {
          "type": ["object", "null"],
          "additionalProperties": true,
          "description": "Host capability detection results (e.g., ALC fix presence)."
        }
      }
    },
    "tokenSeeding": {
      "type": ["object", "null"],
      "additionalProperties": true,
      "description": "Status of pre-authorized token seeding for CI (avoids manual OAuth).",
      "properties": {
        "tidal": {
          "type": ["object", "null"],
          "additionalProperties": false,
          "description": "Tidal token seeding status.",
          "properties": {
            "status": {
              "type": ["string", "null"],
              "enum": ["deployed", "skipped", "staged", "failed", null],
              "description": "Token seeding status: deployed (written to config), skipped (not needed or file exists), staged (validated but not yet deployed), failed (error occurred)."
            },
            "reason": {
              "type": ["string", "null"],
              "enum": [
                "no_secret_provided",
                "invalid_base64",
                "invalid_json",
                "file_exists",
                "token_still_valid",
                "token_expired",
                "no_expiry_field",
                "expiry_unknown",
                "force_overwrite",
                "no_existing_file",
                null
              ],
              "description": "Reason for deploy/skip/failure. Freshness reasons: token_expired (overwritten), token_still_valid (skipped), no_expiry_field/expiry_unknown (overwritten to be safe)."
            },
            "errorCode": {
              "type": ["string", "null"],
              "enum": [
                "E2E_TOKEN_SEED_INVALID_BASE64",
                "E2E_TOKEN_SEED_INVALID_JSON",
                "E2E_TOKEN_SEED_MISSING_SECRET",
                "E2E_TOKEN_SEED_IO_ERROR",
                "E2E_TOKEN_SEED_EXPIRY_PARSE_ERROR",
                null
              ],
              "description": "Explicit error code for seeding failures. Emitted directly from seeding step, not inferred by classifier."
            },
            "deployed": {
              "type": "boolean",
              "description": "Whether tokens were successfully written to the config directory."
            },
            "targetPathKind": {
              "type": ["string", "null"],
              "enum": ["configPath", null],
              "description": "Kind of path where tokens were deployed (redacted for security). configPath = /config/plugins/..."
            },
            "seededAtUtc": {
              "type": ["string", "null"],
              "format": "date-time",
              "description": "ISO 8601 timestamp when tokens were seeded (for postmortem debugging)."
            },
            "overwriteMode": {
              "type": ["string", "null"],
              "enum": ["auto", "always", "never", null],
              "description": "Overwrite mode that was in effect during seeding."
            }
          }
        }
      }
    },
    "request": {
      "type": "object",
      "additionalProperties": false,
      "required": ["gate", "plugins"],
      "properties": {
        "gate": {
          "type": "string",
          "description": "Requested gate (e.g., bootstrap, search)."
        },
        "plugins": {
          "type": ["string", "array"],
          "description": "Requested plugins (string or array)."
        }
      }
    },
    "effective": {
      "type": "object",
      "additionalProperties": false,
      "required": ["gates", "plugins"],
      "properties": {
        "gates": {
          "type": "array",
          "items": { "type": "string" },
          "description": "Expanded gates to execute."
        },
        "plugins": {
          "type": ["string", "array"],
          "description": "Effective plugins."
        },
        "stopReason": {
          "type": ["string", "null"],
          "description": "Reason execution stopped early (null if completed)."
        }
      }
    },
    "redaction": {
      "type": "object",
      "additionalProperties": false,
      "required": ["selfTestExecuted", "selfTestPassed", "patternsCount"],
      "properties": {
        "selfTestExecuted": {
          "type": "boolean",
          "description": "Whether redaction self-test ran."
        },
        "selfTestPassed": {
          "type": "boolean",
          "description": "Whether redaction self-test passed."
        },
        "patternsCount": {
          "type": "integer",
          "minimum": 0,
          "description": "Number of redaction patterns loaded."
        }
      }
    },
    "results": {
      "type": "array",
      "items": {
        "$ref": "#/$defs/gateResult"
      },
      "description": "Per-gate test results."
    },
    "summary": {
      "type": "object",
      "additionalProperties": false,
      "required": ["overallSuccess", "totalGates", "passed", "failed", "skipped", "totalDurationMs"],
      "properties": {
        "overallSuccess": {
          "type": "boolean",
          "description": "True if all non-skipped gates passed."
        },
        "totalGates": {
          "type": "integer",
          "minimum": 0,
          "description": "Total number of gate results."
        },
        "passed": {
          "type": "integer",
          "minimum": 0,
          "description": "Gates with outcome=success."
        },
        "failed": {
          "type": "integer",
          "minimum": 0,
          "description": "Gates with outcome=failed."
        },
        "skipped": {
          "type": "integer",
          "minimum": 0,
          "description": "Gates with outcome=skipped."
        },
        "totalDurationMs": {
          "type": "integer",
          "minimum": 0,
          "description": "Sum of all gate durations."
        }
      }
    },
    "diagnostics": {
      "type": "object",
      "additionalProperties": true,
      "required": ["bundleCreated", "redactionApplied"],
      "properties": {
        "bundlePath": {
          "type": ["string", "null"],
          "description": "Path to diagnostics bundle if created."
        },
        "bundleCreated": {
          "type": "boolean",
          "description": "Whether diagnostics bundle was created."
        },
        "includedFiles": {
          "type": ["array", "null"],
          "items": { "type": "string" },
          "description": "Files included in diagnostics bundle."
        },
        "redactionApplied": {
          "type": "boolean",
          "description": "Whether redaction was applied to bundle."
        },
        "redactionSelfTestPassed": {
          "type": "boolean",
          "description": "Whether redaction self-test passed."
        }
      }
    },
    "hostBugSuspected": {
      "type": "object",
      "additionalProperties": true,
      "required": ["detected"],
      "properties": {
        "detected": {
          "type": "boolean",
          "description": "Whether a host bug pattern was detected."
        },
        "classification": {
          "type": "string",
          "description": "Bug classification (ALC, ABI_MISMATCH, DEPENDENCY_DRIFT, LOAD_FAILURE)."
        },
        "severity": {
          "type": "string",
          "description": "Severity level (host_bug, plugin_rebuild, version_conflict, investigate)."
        },
        "matchedLine": {
          "type": "string",
          "description": "Sanitized error line that matched."
        }
      }
    },
    "componentIds": {
      "type": "object",
      "additionalProperties": false,
      "description": "Component ID resolution and persistence settings for this run.",
      "properties": {
        "instanceKey": {
          "type": "string",
          "minLength": 1,
          "description": "The instance key used to scope preferred component IDs."
        },
        "instanceKeySource": {
          "type": "string",
          "enum": ["explicit", "computed"],
          "description": "How the instance key was determined: explicit (from E2E_INSTANCE_KEY env var or parameter) or computed (hash of url|container|salt)."
        },
        "lockPolicy": {
          "type": "object",
          "additionalProperties": false,
          "description": "Lock policy settings used for state file persistence.",
          "properties": {
            "timeoutMs": {
              "type": "integer",
              "minimum": 0,
              "description": "Lock acquisition timeout in milliseconds."
            },
            "retryDelayMs": {
              "type": "integer",
              "minimum": 1,
              "description": "Delay between lock retry attempts in milliseconds."
            },
            "staleSeconds": {
              "type": "integer",
              "minimum": 0,
              "description": "Age in seconds after which a stale lock is auto-removed."
            }
          }
        },
        "lockPolicySource": {
          "type": "string",
          "enum": ["default", "env"],
          "description": "How lock policy was determined: default (hardcoded values) or env (from E2E_COMPONENT_IDS_LOCK_* env vars)."
        },
        "persistenceEnabled": {
          "type": "boolean",
          "description": "Whether component ID state persistence is enabled for this run."
        },
        "persistenceEligible": {
          "type": "boolean",
          "description": "Whether any component resolution had safeToPersist=true (eligible to persist)."
        },
        "persistedIdsUpdateAttempted": {
          "type": "boolean",
          "description": "Whether an attempt was made to write component ID state."
        },
        "persistedIdsUpdated": {
          "type": "boolean",
          "description": "Whether component ID state was actually written. Only true when write succeeded."
        },
        "persistedIdsUpdateReason": {
          "type": "string",
          "enum": ["disabled", "not_eligible", "no_changes", "lock_timeout", "io_error", "written", "unknown"],
          "description": "Reason for the persistence outcome: disabled (persistence off), not_eligible (no safe IDs), no_changes (file unchanged), lock_timeout (couldn't acquire lock), io_error (write failed), written (success), unknown (no info)."
        }
      }
    }
  },
  "$defs": {
    "gateResult": {
      "type": "object",
      "additionalProperties": false,
      "required": ["gate", "plugin", "outcome", "errors", "details"],
      "properties": {
        "gate": {
          "type": "string",
          "minLength": 1,
          "description": "Gate name (Schema, Configure, Search, etc.)."
        },
        "plugin": {
          "type": "string",
          "minLength": 1,
          "description": "Plugin name being tested."
        },
        "outcome": {
          "type": "string",
          "enum": ["success", "failed", "skipped"],
          "description": "Gate execution outcome."
        },
        "errorCode": {
          "oneOf": [
            { "type": "null" },
            {
              "type": "string",
              "pattern": "^E2E_[A-Z0-9_]+$"
            }
          ],
          "description": "Structured error code (null for success/skipped)."
        },
        "outcomeReason": {
          "type": ["string", "null"],
          "description": "Human-readable reason for outcome."
        },
        "startedAt": {
          "type": ["string", "null"],
          "format": "date-time",
          "description": "Gate execution start time."
        },
        "endedAt": {
          "type": ["string", "null"],
          "format": "date-time",
          "description": "Gate execution end time."
        },
        "durationMs": {
          "type": "integer",
          "minimum": 0,
          "description": "Gate execution duration in milliseconds."
        },
        "errors": {
          "type": "array",
          "items": { "type": "string" },
          "description": "Error messages (empty for success)."
        },
        "details": {
          "type": "object",
          "additionalProperties": true,
          "description": "Gate-specific details (extensible).",
          "properties": {
            "componentResolution": {
              "$ref": "#/$defs/componentResolution"
            }
          }
        }
      }
    },
    "componentResolution": {
      "type": "object",
      "additionalProperties": false,
      "description": "Component selection resolution details for indexer, downloadClient, and importList.",
      "properties": {
        "indexer": {
          "$ref": "#/$defs/componentResolutionEntry"
        },
        "downloadClient": {
          "$ref": "#/$defs/componentResolutionEntry"
        },
        "importList": {
          "$ref": "#/$defs/componentResolutionEntry"
        }
      }
    },
    "componentResolutionEntry": {
      "type": "object",
      "additionalProperties": false,
      "description": "Resolution details for a single component type.",
      "required": ["selectedId", "strategy", "matchedOn", "candidateIds", "safeToPersist"],
      "properties": {
        "selectedId": {
          "oneOf": [
            { "type": "null" },
            { "type": "integer" }
          ],
          "description": "The ID of the selected component, or null if none."
        },
        "strategy": {
          "type": "string",
          "description": "The resolution strategy used (preferredId, implementationName, implementation, created, ambiguous*, updated, fuzzy, none)."
        },
        "matchedOn": {
          "type": "string",
          "enum": ["preferredId", "implementationName", "implementation", "created", "none"],
          "description": "Normalized enum derived from strategy. Maps known safe strategies to canonical lowerCamelCase values, or 'none' for ambiguous/unknown."
        },
        "candidateIds": {
          "type": "array",
          "items": { "type": "integer" },
          "description": "Array of candidate component IDs. Defaults to [selectedId] when unambiguous."
        },
        "safeToPersist": {
          "type": "boolean",
          "description": "Whether it is safe to persist this ID for future runs. False for ambiguous, fuzzy, updated, or null selectedId."
        }
      }
    }
  }
}
