{
  "schemaVersion": "1.2",
  "schemaId": "richer-tunes.lidarr.e2e-run-manifest",
  "timestamp": "2026-01-03T00:00:00Z",
  "runId": "disc12345678",
  "runner": {
    "name": "e2e-runner",
    "version": "abc1234",
    "args": ["-Gate", "configure", "-Plugins", "Qobuzarr"]
  },
  "lidarr": {
    "url": "http://localhost:8686",
    "containerName": "lidarr-e2e-test",
    "containerId": "abc123def456",
    "version": "3.1.3.4970",
    "branch": "plugins"
  },
  "request": {
    "gate": "configure",
    "plugins": ["Qobuzarr"]
  },
  "effective": {
    "gates": ["Schema"],
    "plugins": ["Qobuzarr"],
    "stopReason": "host_bug_detected"
  },
  "redaction": {
    "selfTestExecuted": true,
    "selfTestPassed": true,
    "patternsCount": 15
  },
  "results": [
    {
      "gate": "Schema",
      "plugin": "Qobuzarr",
      "outcome": "failed",
      "errorCode": "E2E_HOST_PLUGIN_DISCOVERY_DISABLED",
      "outcomeReason": "Plugins exist on disk but host is not loading them",
      "startedAt": "2026-01-03T00:00:01Z",
      "endedAt": "2026-01-03T00:00:02Z",
      "durationMs": 1000,
      "errors": ["Plugin files exist in /config/plugins but /api/v1/system/plugins returns empty array"],
      "details": {}
    }
  ],
  "summary": {
    "overallSuccess": false,
    "totalGates": 1,
    "passed": 0,
    "failed": 1,
    "skipped": 0,
    "totalDurationMs": 1000
  },
  "diagnostics": {
    "bundleCreated": true,
    "bundlePath": ".e2e-bootstrap/diagnostics/bundle.zip",
    "redactionApplied": true
  },
  "hostBugSuspected": {
    "detected": true,
    "classification": "DISCOVERY_DISABLED",
    "severity": "host_bug",
    "matchedLine": "Plugin discovery appears to be disabled - files exist but no plugins loaded"
  }
}
