{
  "$schema": "https://raw.githubusercontent.com/RicherTunes/Lidarr.Plugin.Common/main/docs/reference/e2e-run-manifest.schema.json",
  "schemaVersion": "1.2",
  "schemaId": "richer-tunes.lidarr.e2e-run-manifest",
  "timestamp": "2026-01-02T12:00:00.000Z",
  "runId": "golden-pass",
  "runner": {
    "name": "lidarr.plugin.common:e2e-runner.ps1",
    "version": "deadbeef",
    "args": [
      "-Gate",
      "bootstrap",
      "-Plugins",
      "Qobuzarr,Tidalarr,Brainarr"
    ]
  },
  "lidarr": {
    "url": "http://[LOCALHOST]:8686",
    "containerName": "lidarr-e2e-test",
    "imageTag": "nightly-3.1.3.4970",
    "imageDigest": "sha256:0000000000000000000000000000000000000000000000000000000000000000",
    "version": "3.1.3.4970",
    "branch": "plugins",
    "containerId": "000000000000",
    "startedAt": "2026-01-02T11:59:00.000Z",
    "imageId": "sha256:1111111111111111111111111111111111111111111111111111111111111111"
  },
  "request": {
    "gate": "bootstrap",
    "plugins": [
      "Qobuzarr",
      "Tidalarr",
      "Brainarr"
    ]
  },
  "effective": {
    "gates": [
      "Schema"
    ],
    "plugins": [
      "Qobuzarr",
      "Tidalarr",
      "Brainarr"
    ],
    "stopReason": null
  },
  "redaction": {
    "selfTestExecuted": true,
    "selfTestPassed": true,
    "patternsCount": 42
  },
  "results": [
    {
      "gate": "Schema",
      "plugin": "Qobuzarr",
      "outcome": "success",
      "errorCode": null,
      "outcomeReason": null,
      "startedAt": "2026-01-02T12:00:01.000Z",
      "endedAt": "2026-01-02T12:00:02.000Z",
      "durationMs": 1000,
      "errors": [],
      "details": {
        "indexerFound": true,
        "downloadClientFound": true
      }
    }
  ],
  "summary": {
    "overallSuccess": true,
    "totalGates": 1,
    "passed": 1,
    "failed": 0,
    "skipped": 0,
    "totalDurationMs": 1000
  },
  "diagnostics": {
    "bundlePath": null,
    "bundleCreated": false,
    "includedFiles": [
      "run-manifest.json",
      "container.log",
      "inspect.json"
    ],
    "redactionApplied": true,
    "redactionSelfTestPassed": true
  },
  "hostBugSuspected": {
    "detected": false
  }
}

