{
  "$schema": "https://raw.githubusercontent.com/RicherTunes/Lidarr.Plugin.Common/main/docs/reference/e2e-run-manifest.schema.json",
  "schemaVersion": "1.2",
  "schemaId": "richer-tunes.lidarr.e2e-run-manifest",
  "timestamp": "2026-01-02T12:00:00Z",
  "runId": "golden-schema-missing-implementation",
  "runner": {
    "name": "lidarr.plugin.common:e2e-runner.ps1",
    "version": "deadbeef",
    "args": [
      "-Gate",
      "schema",
      "-Plugins",
      "Qobuzarr"
    ]
  },
  "lidarr": {
    "url": "http://[LOCALHOST]:8686",
    "containerName": "lidarr-e2e-test",
    "imageTag": "nightly-3.1.3.4970",
    "imageDigest": "sha256:0000000000000000000000000000000000000000000000000000000000000000",
    "version": "3.1.3.4970",
    "branch": "plugins",
    "containerId": "000000000000",
    "startedAt": "2026-01-02T11:59:00Z",
    "imageId": "sha256:1111111111111111111111111111111111111111111111111111111111111111"
  },
  "request": {
    "gate": "schema",
    "plugins": [
      "Qobuzarr"
    ]
  },
  "effective": {
    "gates": [
      "Schema"
    ],
    "plugins": [
      "Qobuzarr"
    ],
    "stopReason": "failed at Schema for Qobuzarr"
  },
  "redaction": {
    "selfTestExecuted": true,
    "selfTestPassed": true,
    "patternsCount": 42
  },
  "results": [
    {
      "gate": "Schema",
      "plugin": "Qobuzarr",
      "outcome": "failed",
      "errorCode": "E2E_SCHEMA_MISSING_IMPLEMENTATION",
      "outcomeReason": "Schema endpoint reachable but implementation not found",
      "startedAt": "2026-01-02T12:00:01Z",
      "endedAt": "2026-01-02T12:00:02Z",
      "durationMs": 1000,
      "errors": [
        "E2E_SCHEMA_MISSING_IMPLEMENTATION: Schema endpoint reachable but 'Qobuzarr' implementation not found. See details.discoveryDiagnosis for diagnosis."
      ],
      "details": {
        "indexerFound": false,
        "downloadClientFound": false,
        "importListFound": false,
        "discoveryDiagnosis": {
          "schemaEndpointReachable": true,
          "indexerSchemaCount": 30,
          "downloadClientSchemaCount": 10,
          "importListSchemaCount": 0,
          "pluginImplementationFound": false,
          "pluginPackagePresent": null,
          "pluginJsonPresent": null,
          "pluginAssemblyPresent": null,
          "hostPluginDiscoveryEnabled": null
        }
      }
    }
  ],
  "summary": {
    "overallSuccess": false,
    "totalGates": 1,
    "passed": 0,
    "failed": 1,
    "skipped": 0,
    "totalDurationMs": 1000
  },
  "diagnostics": {
    "bundlePath": "diagnostics-2026-01-02T12-00-00Z.zip",
    "bundleCreated": true,
    "includedFiles": [
      "run-manifest.json",
      "container.log",
      "inspect.json"
    ],
    "redactionApplied": true,
    "redactionSelfTestPassed": true
  },
  "hostBugSuspected": {
    "detected": false
  }
}

