{
  "$schema": "https://raw.githubusercontent.com/RicherTunes/Lidarr.Plugin.Common/main/docs/reference/e2e-run-manifest.schema.json",
  "schemaVersion": "1.2",
  "schemaId": "richer-tunes.lidarr.e2e-run-manifest",
  "timestamp": "2026-01-02T12:10:00.000Z",
  "runId": "golden-auth-missing",
  "runner": {
    "name": "lidarr.plugin.common:e2e-runner.ps1",
    "version": "deadbeef",
    "args": [
      "-Gate",
      "all",
      "-Plugins",
      "Qobuzarr"
    ]
  },
  "lidarr": {
    "url": "http://[LOCALHOST]:8686",
    "containerName": "lidarr-e2e-test",
    "imageTag": "nightly-3.1.3.4970",
    "imageDigest": "sha256:0000000000000000000000000000000000000000000000000000000000000000",
    "version": "3.1.3.4970",
    "branch": "plugins",
    "containerId": "000000000000",
    "startedAt": "2026-01-02T12:09:00.000Z",
    "imageId": "sha256:1111111111111111111111111111111111111111111111111111111111111111"
  },
  "request": {
    "gate": "all",
    "plugins": [
      "Qobuzarr"
    ]
  },
  "effective": {
    "gates": [
      "Schema",
      "Search"
    ],
    "plugins": [
      "Qobuzarr"
    ],
    "stopReason": "failed at Search for Qobuzarr"
  },
  "redaction": {
    "selfTestExecuted": true,
    "selfTestPassed": true,
    "patternsCount": 42
  },
  "results": [
    {
      "gate": "Schema",
      "plugin": "Qobuzarr",
      "outcome": "success",
      "errorCode": null,
      "outcomeReason": null,
      "startedAt": "2026-01-02T12:10:01.000Z",
      "endedAt": "2026-01-02T12:10:02.000Z",
      "durationMs": 1000,
      "errors": [],
      "details": {
        "indexerFound": true,
        "downloadClientFound": true
      }
    },
    {
      "gate": "Search",
      "plugin": "Qobuzarr",
      "outcome": "failed",
      "errorCode": "E2E_AUTH_MISSING",
      "outcomeReason": "Strict prereqs: Credentials not configured (missing: authToken)",
      "startedAt": "2026-01-02T12:10:03.000Z",
      "endedAt": "2026-01-02T12:10:04.000Z",
      "durationMs": 1000,
      "errors": [
        "Strict prereqs: Credentials not configured (missing: authToken)"
      ],
      "details": {
        "skipReason": "Credentials not configured (missing: authToken)"
      }
    }
  ],
  "summary": {
    "overallSuccess": false,
    "totalGates": 2,
    "passed": 1,
    "failed": 1,
    "skipped": 0,
    "totalDurationMs": 2000
  },
  "diagnostics": {
    "bundlePath": null,
    "bundleCreated": false,
    "includedFiles": [
      "run-manifest.json",
      "container.log",
      "inspect.json"
    ],
    "redactionApplied": true,
    "redactionSelfTestPassed": true
  },
  "hostBugSuspected": {
    "detected": false
  }
}

