{
  "$schema": "https://raw.githubusercontent.com/RicherTunes/Lidarr.Plugin.Common/main/docs/reference/e2e-run-manifest.schema.json",
  "schemaVersion": "1.2",
  "schemaId": "richer-tunes.lidarr.e2e-run-manifest",
  "timestamp": "2024-01-15T10:30:00Z",
  "runId": "coldstart-nosecrets",
  "runner": {
    "name": "lidarr.plugin.common:e2e-runner.ps1",
    "version": "abc1234",
    "args": ["-Gate", "configure", "-Plugins", "Qobuzarr,Tidalarr,Brainarr"]
  },
  "sources": {
    "common": { "sha": "abc1234", "source": "git" }
  },
  "lidarr": {
    "url": "http://localhost:8686",
    "containerName": "lidarr-e2e-test"
  },
  "request": {
    "gate": "configure",
    "plugins": ["Qobuzarr", "Tidalarr", "Brainarr"]
  },
  "effective": {
    "gates": ["Schema", "Configure"],
    "plugins": ["Qobuzarr", "Tidalarr", "Brainarr"],
    "stopReason": null
  },
  "redaction": {
    "selfTestExecuted": true,
    "selfTestPassed": true,
    "patternsCount": 22
  },
  "results": [
    {
      "gate": "Schema",
      "plugin": "Qobuzarr",
      "outcome": "success",
      "errorCode": null,
      "outcomeReason": null,
      "startedAt": "2024-01-15T10:30:00Z",
      "endedAt": "2024-01-15T10:30:01Z",
      "durationMs": 1000,
      "errors": [],
      "details": {}
    },
    {
      "gate": "Configure",
      "plugin": "Qobuzarr",
      "outcome": "skipped",
      "errorCode": "E2E_AUTH_MISSING",
      "outcomeReason": "Missing env vars",
      "startedAt": "2024-01-15T10:30:01Z",
      "endedAt": "2024-01-15T10:30:02Z",
      "durationMs": 1000,
      "errors": [],
      "details": { "created": false, "updated": false }
    },
    {
      "gate": "Schema",
      "plugin": "Tidalarr",
      "outcome": "success",
      "errorCode": null,
      "outcomeReason": null,
      "startedAt": "2024-01-15T10:30:00Z",
      "endedAt": "2024-01-15T10:30:01Z",
      "durationMs": 1000,
      "errors": [],
      "details": {}
    },
    {
      "gate": "Configure",
      "plugin": "Tidalarr",
      "outcome": "skipped",
      "errorCode": "E2E_AUTH_MISSING",
      "outcomeReason": "Missing env vars",
      "startedAt": "2024-01-15T10:30:01Z",
      "endedAt": "2024-01-15T10:30:02Z",
      "durationMs": 1000,
      "errors": [],
      "details": { "created": false, "updated": false }
    },
    {
      "gate": "Schema",
      "plugin": "Brainarr",
      "outcome": "success",
      "errorCode": null,
      "outcomeReason": null,
      "startedAt": "2024-01-15T10:30:00Z",
      "endedAt": "2024-01-15T10:30:01Z",
      "durationMs": 1000,
      "errors": [],
      "details": {}
    },
    {
      "gate": "Configure",
      "plugin": "Brainarr",
      "outcome": "skipped",
      "errorCode": "E2E_AUTH_MISSING",
      "outcomeReason": "Missing env vars",
      "startedAt": "2024-01-15T10:30:01Z",
      "endedAt": "2024-01-15T10:30:02Z",
      "durationMs": 1000,
      "errors": [],
      "details": { "created": false, "updated": false }
    }
  ],
  "summary": {
    "overallSuccess": true,
    "totalGates": 6,
    "passed": 3,
    "failed": 0,
    "skipped": 3,
    "totalDurationMs": 2000
  },
  "diagnostics": {
    "bundlePath": null,
    "bundleCreated": false,
    "includedFiles": [],
    "redactionApplied": true,
    "redactionSelfTestPassed": true
  },
  "hostBugSuspected": {
    "detected": false
  },
  "componentIds": {
    "instanceKey": "i-test",
    "instanceKeySource": "computed",
    "lockPolicy": { "timeoutMs": 3000, "retryDelayMs": 250, "staleSeconds": 60 },
    "lockPolicySource": "default",
    "persistenceEnabled": true,
    "persistenceEligible": false,
    "persistedIdsUpdateAttempted": false,
    "persistedIdsUpdated": false,
    "persistedIdsUpdateReason": "not_eligible"
  }
}

